utterances,Core Relations
what other movies die charles vidor direct,movie.directed_by
show me all movies by charles vidor,movie.directed_by
i'd like to see foreign films,movie.country
search for foreign movies,movie.country
what are some universal pictures films,movie.production_companies
show me all the movies made by universal,movie.production_companies
find historical movies,movie.genre
display the films by 7 arts,movie.production_companies
show movies done by 7 arts,movie.production_companies
can you show me a korean movie,movie.country_movie.language
find korean movies,movie.country_movie.language
korean movie,movie.country_movie.language
show me korean movies,movie.country_movie.language
i want to watch a korean movie,movie.country_movie.language
find all rated pg-13 movies with eddie murphy,movie.rating_movie.starring.actor
twentieth century fox movies since 1990,movie.initial_release_date
can you show me movies starring denzel washington please,movie.starring.actor
i want to see movies starring denzel washington,movie.starring.actor
please show me movies starring denzel washington,movie.starring.actor
show me movies starring denzel washington,movie.starring.actor
all the movies by kareena,movie.starring.actor
find movies of kareena,movie.starring.actor
find prison break movies,none
find movies produced by spike lee,movie.produced_by
has spike lee produced any films,movie.produced_by
search for movies produced by spike lee,movie.produced_by
give me a list of woody allen films,movie.directed_by
show all movies directed by woody allen,movie.directed_by
woody movies,movie.directed_by
please find all movies woody allen has directed,movie.directed_by
what movies were directed by woody allen,movie.directed_by
which movies does gabrielle union come out in,movie.starring.actor
give me anything directed by robert wise,movie.directed_by
list all robert wise movies,movie.directed_by
show me a list of movies directed by robert wise,movie.directed_by
what are all of the movies directed by robert wise,movie.directed_by
list all of the movies that have been directed by robert wise,movie.directed_by
what are all movies produced by chris nolan,movie.produced_by
show me movies in german,movie.language
display movies in german,movie.language
do you have in movies in german,movie.language
i only want to see movies in german,movie.language
watch movies in german language,movie.language
find films in german,movie.language
get german language films,movie.language
show movies in german,movie.language
show back to the future movies,none
show me back to the future movies,none
movie results for back to the future,none
show me a list of movies that christian bale has starred in during his career,movie.starring.actor
what are all of the movies acted in by the actor christian bale,movie.starring.actor
what are all the movies played in by chrisian bale,movie.starring.actor
what movies has christian bale acted in,movie.starring.actor
what movies has christian bale appeared in,movie.starring.actor
what movies have christian bale played in,movie.starring.actor
what movies and upcoming movies will christian bale star in,movie.starring.actor
find me movies by jj abrams,movie.directed_by
brad pitt movie now,movie.starring.actor
brad pitt movies,movie.starring.actor
can you please list all movies with brad pitt,movie.starring.actor
can you please list all movies with brad pitt,movie.starring.actor
can you please list the movies brad pitt has acted in,movie.starring.actor
can you show me a movie with brad pitt,movie.starring.actor
i want to watch movies with brad pitt,movie.starring.actor
list all brad pitt movies,movie.starring.actor
list brad pitt movies,movie.starring.actor
look for movies with brad pitt in them,movie.starring.actor
movie with brad pitt,movie.starring.actor
show all brad pitt movies,movie.starring.actor
show brad pitt movies,movie.starring.actor
show me brad pitt movies,movie.starring.actor
show movies with brad pitt,movie.starring.actor
what movie brad pitt in,movie.starring.actor
what movies have brad pitt,movie.starring.actor
sort by all brad pitt movies,movie.directed_by_movie.starring.actor
what movies did tom hanks direct that he also starred in,movie.directed_by_movie.starring.actor
show me a list of all movies directed by tom hanks starting with newest to oldest,movie.directed_by_movie.initial_release_date
movies from scotland,movie.country
give me a list of r rated movies,movie.rating
i want to look for movies with an r rating,movie.rating
i want to see all movies with a r rating,movie.rating
please look up r rated movies,movie.rating
rate r movies for adult enterainment,movie.rating
show me all r -rated movies,movie.rating
show me movies that are rated r,movie.rating
find movies with r ratings,movie.rating
find rated r movies,movie.rating
i want to find movies rated r,movie.rating
i want to view movies that are rated r,movie.rating
look up r rated movies,movie.rating
movies with r rating,movie.rating
r - rated,movie.rating
r rated movies,movie.rating
show me movies with a rating of r,movie.rating
what are a list of movies with an r rating,movie.rating
are there any movies that are rated r,movie.rating
compile a list of movies with a r rating,movie.rating
i want an r rated movie,movie.rating
list all rated r movies,movie.rating
r rated movies,movie.rating
search for r rated movies,movie.rating
show me a list of movies with r rating,movie.rating
show me all rated r movies,movie.rating
show me r movies,movie.rating
show me r rated movies,movie.rating
show only rated r movies,movie.rating
what are movies that have a r rating,movie.rating
which movies are rated r,movie.rating
what other videos does the country norway have,movie.country
a showing of movies that are in spanish,movie.language
can you find movies in spanish,movie.language
search for movies in spanish,movie.language
spanish language movies,movie.language
i am looking for movies in spanish,movie.language
i would like to watch movies that are spoken in spanish,movie.language
list of movies in spanish,movie.language
show me movies in spanish,movie.language
can you show me a list of movies in spanish,movie.language
find movies in spanish,movie.language
find movies in spanish,movie.language
give me movies in spanish,movie.language
i would like a list of movies that have been made in spanish,movie.language
movies in spanish,movie.language
please make a list of movies that have been made in spanish,movie.language
send me movies that are in spanish,movie.language
show me movies in spanish,movie.language
show me movies that are in spanish,movie.language
give me swedish films,movie.country_movie.language
show me mexican films,movie.country
show me movies made in south africa,movie.country
list some sci fi movies,movie.genre
show me scifi fantasy movies,movie.genre
find scifi films,movie.genre
list scifi,movie.genre
what movies did matt damon appear in,movie.starring.actor
sound of music robert wise,movie.directed_by
can i watch a terry george film tonight,movie.directed_by
get a list of animated films,movie.genre
show me movies that are about scary zombies,movie.subjects
is there a movie about the zombie apocolypse,movie.subjects
i want to see a list about zombie horror films,movie.genre_movie.subjects
find some zombie movies,movie.subjects
find zombie movies,movie.subjects
get list of zombie movies,movie.subjects
give me a list of zombie movies,movie.subjects
i want to find zombie movies,movie.subjects
i want to see zombie movies,movie.subjects
see zombie movies,movie.subjects
show me zombie movies,movie.subjects
show me zombie movies,movie.subjects
show zombie movies,movie.subjects
zombie movie favorites,movie.subjects
find me a movie with zombies,movie.subjects
show me movies about zombies,movie.subjects
show me movies about zombies,movie.subjects
show me movies about zombies,movie.subjects
show movies of zombies,movie.subjects
which movies are based on zombies,movie.subjects
which movies have zombies in them,movie.subjects
movies about zombies,movie.subjects
display movies of zombies,movie.subjects
get movies about zombies,movie.subjects
movies about zombies,movie.subjects
i want scary zombie movies,movie.genre_movie.subjects
i want to see zombie movies that are scary,movie.genre_movie.subjects
find movies directed by niel abramson,movie.directed_by
zombies,movie.subjects
what movies are directed by ridley scott,movie.directed_by
i want to see movies directed by ridley scott,movie.directed_by
german movie info,movie.country_movie.language
i want to watch a german movie,movie.country_movie.language
info german movie,movie.country_movie.language
show german movies,movie.country_movie.language
find action movies,movie.genre
looking for an action movie,movie.genre
what is the ratings of action movies,movie.genre_movie.rating
movies patrick swayze played in,movie.starring.actor
show me a movie that starred patrick swayze,movie.starring.actor
show me short films,movie.genre
movies by george lucas,movie.directed_by
list of all dutch movies,movie.country_movie.language
please give me a dutch movie listing,movie.country_movie.language
dutch movie listing,movie.country_movie.language
show me childrens movies,movie.genre
movies tom cruise produced,movie.produced_by
what movies did harry weinstein produce,movie.produced_by
i want to look for movies produced by morgan freeman,movie.produced_by
i would like to find movies produced by morgan freeman,movie.produced_by
look for movies produced by morgan freeman,movie.produced_by
search for movies produced by morgan freeman,movie.produced_by
what movies are in bengali,movie.language
meryl streep movies,movie.starring.actor
movies frances ford copolla,movie.directed_by
what movie did victor fleming direct,movie.directed_by
movies from russia,movie.country
search for films produced in russia,movie.country
find movies produced in russia,movie.country
find all details about star wars-a new hope movie,none
show all details about star wars-a new hope movie,none
get me information about the movie star wars four,none
can you show me details about the movie star wars:episode four - a new hope,none
give me detailed information about the movie star wars:episode four -a new hope,none
i would like to get some information about the movie star wars:episode four -a new hope,none
list star wars movie a new hope,none
find info about star wars episode four,none
get me info on star wars episode four,none
get me star wars episode four details,none
i want to see info about star wars four,none
run a search for star wars four,none
show me star wars four,none
show me star wars four page,none
star wars four,none
take me to star wars four page,none
where can i watch star wars four,none
tell about star wars iv,none
what is full name of star wars iv,none
darth vader,movie.starring.character
han solo,movie.starring.character
i only want movies by sidney lumit,movie.directed_by
movies with sally field,movie.starring.actor
can you please open page about in july movie,none
display details of in july movie,none
exhibit details of in july movie,none
in july movie page,none
about movie in july,none
find me the film in july,none
show information for the movie title in july with moritz bleibtreu,movie.starring.actor
give me details about the movie in july,none
i want information about the movie in july,none
i would like to get detailed information about the movie in july,none
search the movie in july,none
show data for the movie in july,none
show me detailed information about the movie in july,none
show me more details for the movie in july,none
check movie in july information,none
display information for the movie in july,none
what movies has jack black been in,movie.starring.actor
angelina jolie movies,movie.starring.actor
in which movies has angelina jolie starred,movie.starring.actor
list of movies starring angelina jolie,movie.starring.actor
movies with angelina jolie,movie.starring.actor
show angelina jolie movies,movie.starring.actor
show me all movies for angelina jolie,movie.starring.actor
show movies with angelina jolie,movie.starring.actor
what movies has angelina jolie been in,movie.starring.actor
which movies has angelina jolie been in,movie.starring.actor
list movies starring angelina jolie,movie.starring.actor
list movies with angelina jolie in them,movie.starring.actor
funny kids movies,movie.genre_movie.rating
movies about basketball,movie.subjects
can you locate movies produced by clint eastwood,movie.produced_by
can you show movies produced by clint eastwood,movie.produced_by
find all movies produced by clint eastwood,movie.produced_by
i am looking for movies produced by clint eastwood,movie.produced_by
i need a list of movies produced by clint eastwood,movie.produced_by
please find movies produced by clint eastwood,movie.produced_by
will you provide a list of movies produced by clint eastwood,movie.produced_by
i want to see more movies with katie holmes,movie.starring.actor
find any movies about horses,movie.subjects
what are some current movies with horses as the main topic of the movie,movie.subjects
johnny depp movies,movie.starring.actor
bring up black swan production,none
all the movies of karan johar,movie.directed_by
find movies of karan johar,movie.directed_by
movies of karan johar,movie.directed_by
find director movies,movie.directed_by
find a list of directors and their movies,movie.directed_by
movies and who directed them,movie.directed_by
bring up all director movies,movie.directed_by
list director movies,movie.directed_by
show movies directed by,movie.directed_by
i want to look up information about the movie hotel transylvania,none
will ferrell been in,movie.starring.actor
what has will ferrell done,movie.starring.actor
find movies about gambling,movie.subjects
find movies about ice skating,movie.subjects
generate a list of movies about ice skating,movie.subjects
list ice skating movies please,movie.subjects
are there any movies with ice skating,movie.subjects
please show me movies about ice skating,movie.subjects
search for movies about ice skating,movie.subjects
are there any movies with skating on ice,movie.subjects
find dreamworks movies for kids,movie.production_companies_movie.rating
where can i see a list of movies produced in great britain,movie.country
taye diggs films,movie.starring.actor
about house at the end of the street,none
find me info on house at the end of the street,none
house at the end of the street movie info,none
i would like to see house at the end of the street information,none
overview of house at the end of the street,none
show me house at the end of the street,none
show me the page about house at the end of the street,none
get me info about the movie house at the end of the street,none
show information for the movie house at the end of the street,none
show me detailed information about the movie house at the end of the street,none
show me more details for the movie house at the end of the street,none
can you give me detailed information about the movie house at the end of the street,none
dispaly info for movie house at the end of the street,none
display overview of the movie house at the end of the street,none
i need information about the cast reviews story etc in detail about the movie house at the end of the street,none
send me movies that are in chinese,movie.language
i want chinese language movies,movie.language
show me movies in chinese,movie.language
find all chinese language movies,movie.language
look up movies in chinese,movie.language
movies in chinese,movie.language
show me movies produced by julian fellows,movie.produced_by
julian fellows productions,movie.produced_by
can you please search movies of tom cruise,movie.starring.actor
find movies with tom cruise,movie.starring.actor
find movies with tom cruise in them,movie.starring.actor
in what movies tom cruise is,movie.starring.actor
movies starring tom cruise,movie.starring.actor
show me all movies tom cruise has been in,movie.starring.actor
tom cruise movies,movie.starring.actor
tom cruise movies,movie.starring.actor
what movies has tom cruise been in,movie.starring.actor
what movies has tom cruise starred in,movie.starring.actor
find movies produced by george lucas,movie.produced_by
find movies produced by george lucus,movie.produced_by
give me a list of movies produced by george lucas,movie.produced_by
give me a list of movies that george lucas produced,movie.produced_by
locate all movies produced by george lucas,movie.produced_by
list of dax shepard movies,movie.starring.actor
find movies of yash chopra,movie.directed_by
trouble with the curve was based on what,none
what was the last film robert redford produced,movie.initial_release_date_movie.produced_by
movies about immigration,movie.subjects
dawn of the dead movie information,none
search the campaign movie,none
show me information related to the film the campaign,none
will you please show me info on the movie the campaign,none
the campaign movie page,none
i want to see info on the movie the campaign,none
look up movie the campaign,none
please show me info on the movie the campaign,none
show me information for the movie the campaign,none
tell me about the movie the campaign in detail,none
can you show me details about the movie the campaign,none
find movies about love,movie.subjects
movies about nature,movie.subjects
show me the comedy pitch perfect,movie.genre
show me the movies produced by reliance,movie.production_companies
which movies are family friendly,movie.rating
can you get me a pg movie list,movie.rating
find a pg rated movie,movie.rating
find rated pg movies,movie.rating
give me some good pg moives,movie.rating
i am looking for movies that are rated pg for family movie night,movie.rating
i need to see a list of pg movies,movie.rating
i need to see all pg movies,movie.rating
movies rated pg,movie.rating
pg movies list please,movie.rating
please show a list of recent movies rated pg,movie.rating
show me movies rated pg,movie.rating
bring up all pg movies,movie.rating
find me pg movies,movie.rating
find movies rated pg,movie.rating
find movies that are pg,movie.rating
i need movies with a pg rating,movie.rating
i want to search for pg rated movies,movie.rating
list movies rated pg,movie.rating
movies with pg rating,movie.rating
movies with pg rating,movie.rating
pg movies,movie.rating
show me pg rated movies,movie.rating
show me the movies rating pg,movie.rating
find movies with pg ratings only,movie.rating
i want a list of pg rated movies,movie.rating
i want to see movies that are rated pg,movie.rating
only show movies rated pg,movie.rating
please find pg rated movies,movie.rating
search for movies with a pg rating,movie.rating
search for movies with a pg rating,movie.rating
show me all pg movies,movie.rating
show me movies with pg rating,movie.rating
show me movies with pg ratings,movie.rating
show me pg movies,movie.rating
get hungarian films,movie.country_movie.language
i want to watch a comedy made in hungary,movie.country_movie.genre
show me hungarian comedies,movie.country_movie.genre_movie.language
what's the latest on brad pitt,movie.initial_release_date_movie.starring.actor
i'm looking for a jason cortlund movie,movie.directed_by
show me the movie now forager,none
what old movies are made by warner brothers,movie.initial_release_date_movie.production_companies
i want to look up alfred hitchcock movies,movie.directed_by
find me movies made by alfred hitchcock,movie.directed_by
i want to search for alfred hitchcock movies,movie.directed_by
i would like to watch an alfred hitchcock movie,movie.directed_by
show me some alfred hitchcock movies,movie.directed_by
look up alfred hitchcock movies,movie.directed_by
movies alfred hitchcock,movie.directed_by
movies by alfred hitchcock,movie.directed_by
movies by alfred hitchcock,movie.directed_by
what movies has alfred hitchcock directed,movie.directed_by
hitchcock movie list,movie.directed_by
list hitchcock movies,movie.directed_by
movie list hitchcock,movie.directed_by
show me hitchcock movies,movie.directed_by
hitchcock movie info,movie.directed_by
hitchcock movies,movie.directed_by
what movies did hitchcock direct,movie.directed_by
show me the last five films for lionsgate,movie.initial_release_date_movie.production_companies
show me recent movies from lionsgate,movie.initial_release_date_movie.production_companies
what new movies does lionsgate have out,movie.initial_release_date_movie.production_companies
show me the movie vulgaria,none
what recently released movies are rated r,movie.initial_release_date_movie.rating
get me a list of current r-rated movies,movie.initial_release_date_movie.rating
show a list of recent releases that are rated pg,movie.initial_release_date_movie.rating
what are some recent released pg movies,movie.initial_release_date_movie.rating
show recent movies rated pg,movie.initial_release_date_movie.rating
will you show me a list of recent movies rated pg,movie.initial_release_date_movie.rating
which current movies are rated pg,movie.initial_release_date_movie.rating
do you have anything by george cukor,movie.directed_by
what was the first movie steven spielberg directed,movie.directed_by_movie.initial_release_date
did rob reiner direct any movies,movie.directed_by
what was the highest making movie,gr.amount_movie.gross_revenue
show me high grossing movies,gr.amount_movie.gross_revenue
what movies made the most money,gr.amount_movie.gross_revenue
what are the top grossing movies,gr.amount_movie.gross_revenue
find the new will ferrell movie,movie.initial_release_date_movie.starring.actor
what are the three latest films with will ferrell,movie.initial_release_date_movie.starring.actor
what are recent films by will ferrell,movie.initial_release_date_movie.starring.actor
any new movies with eddie murphy,movie.initial_release_date_movie.starring.actor
i would like to look for movies about god,movie.subjects
look up movies about god,movie.subjects
i want to look for movies about god,movie.subjects
please search for movies about god,movie.subjects
find ron howard new movie,movie.directed_by_movie.initial_release_date
i need a list of movies produced by ray stark,movie.produced_by
show me all movies produced by ray stark,movie.produced_by
what movies has ray stark produced,movie.produced_by
what movie has albert brooks done lately,movie.initial_release_date_movie.starring.actor
recent movies by steven spielberg,movie.directed_by_movie.initial_release_date
i am looking for movies directed by tom hanks,movie.directed_by
find movies directed by tom hanks,movie.directed_by
show me movies that tom hanks directed,movie.directed_by
movies by tom hanks,movie.directed_by
show me a list of all movies that were directed by tom hanks,movie.directed_by
what movie made the least money,gr.amount_movie.gross_revenue
what has tom cruise acted in lately,movie.initial_release_date_movie.starring.actor
what new movies are playing with rating of pg thirteen,movie.initial_release_date_movie.rating
show me a list of movies that are new and rated pg-13,movie.initial_release_date_movie.rating
what pg-13 movies are currently showing,movie.initial_release_date_movie.rating
what other movies has will smith directed,movie.directed_by
show me the latest movies in kannada,movie.language
have any new movies by twentieth century fox,movie.initial_release_date_movie.production_companies
current movie suggestions,movie.initial_release_date
show me new releases,movie.initial_release_date
see ed harris last movie,movie.initial_release_date_movie.starring.actor
give me a list of recent horror films,movie.genre_movie.initial_release_date
show me movies in swedish,movie.language
about in july,none
i want to go to the homepage for in july,none
i want to view the page on in july,none
i would like to see the main page of in july,none
in july information,none
summary of in july,none
synopsis for in july,none
was life is beautiful made in italy,movie.country
current movies rated g,movie.initial_release_date_movie.rating
find all new releases that are rated g,movie.initial_release_date_movie.rating
can i have a list of movie production companies,none
who is bruce willis,none
producer,none
i need a movie producer list,none
can i have a list of producers,none
find me info on emma watson,none
show me more information about will smith,none
will smith bio,none
i need a list of actors,none
search for actors,none
find actors,none
search movie actors,none
movie actors,none
display actors in movies,none
show actors in movies,none
display biography of actor will ferrell,none
who is the actor will ferrell,none
director,none
find a director,none
find directors,none
search directors,none
search directors,none
movie directors,none
give me a list of directors,none
where can i find a director,none
see bill paxton,none
give me information about elizabeth mcgovern,none
show me information on darla anderson,none
can you give me more information about charles,none
can you tell me more about the producer ray stark,none
give me more details about the producer ray stark,none
i need to know more about the producer ray stark,none
show me more information about the producer ray stark,none
show me information on shelly long,none
i want to know about clint eastwood,none
look for information about charles vidor,none
search for information about charles vidor,none
want to see charles vidor,none
who is childs vidor,none
find me more information on scorscese,none
find the director andrew stanton,none
who is andrew stanton,none
see the olsen twins,none
can you find more information on albert ruddy,none
search for information about tom cruise,none
find information about tom cruise,none
look for information about tom cruise,none
look up information about tom cruise,none
all about will farrell please,none
bio on will ferrell,none
biography for will ferrell,none
bring me to will ferrell informaion,none
bring up a bio on will ferrell,none
