utterances,Core Relations
movies from england,movie.country
movies from england,movie.country
movies from england please,movie.country
show me england movies,movie.country
show me movies from england,movie.country
show me movies made in england,movie.country
find movies directed by chris columbus,movie.directed_by
what other movies has richard lester directed,movie.directed_by
search for movies by language,movie.language
mandarin movie please,movie.language
please find a movie in mandarin,movie.language
movie made in mandarin,movie.language
which movies are originally in a foreign language,movie.language
find me tamil movies,movie.language
show me the latest movies in tamil,movie.language
find hindi movies,movie.language
find movies in hindi,movie.language
list the hindi movies,movie.language
what is hindi,movie.language
i would like to get a list of movie names in hindi language,movie.language
what films are not spoken in english,movie.language
what movies are spoken in another language,movie.language
i want to watch a romance made in india,movie.country_movie.genre
i need to get a list of some romantic indian movies,movie.country_movie.genre_movie.language
find movies from india,movie.country
look up movies from india,movie.country
see movies from india,movie.country
find indian movies,movie.country_movie.language
give me a list of some indian movies,movie.country_movie.language
brian de palma movies,movie.directed_by
complete list of movies made by searchlight films,movie.production_companies
list movies by searchlight films,movie.production_companies
list of movies produced by searchlight films,movie.production_companies
what are some movies made by searchlight films,movie.production_companies
movies about bank robberies,movie.subjects
show me sarah polley movies,movie.starring.actor
show me french r rated dramas,movie.country_movie.genre_movie.language_movie.rating
list french language comedy films,movie.genre_movie.language
show french comedy films,movie.genre_movie.language
what are some movies that were produced in europe,movie.country
films produced by laurie macdonald,movie.produced_by
find me dreamworks films,movie.production_companies
movie by dreamworks,movie.production_companies
movie made by dreamworks,movie.production_companies
what movies are made by dreamworks,movie.production_companies
i'm looking for the cost of some movies,movie.estimated_budget
what movies did kevin costner direct,movie.directed_by
dirty dancing movie,none
dirty dancing movie short cuts,none
show me the dirty dancing movie,none
will you please show me info on the movie dirty dancing,none
find the movie dirty dancing,none
get me info for the movie dirty dancing,none
i need to get every possible information related with the movie dirty dancing,none
i want to see infomation on the movie dirty dancing,none
i would like to get all the information about the movie dirty dancing,none
please show me info on the movie dirty dancing,none
show me all the information about the movie dirty dancing like story reviews cast etc,none
show me info on the movie dirty dancing please,none
show me information for the movie dirty dancing,none
show me more details for the movie dirty dancing,none
can you please show me info on the movie dirty dancing,none
can you tell me about the movie dirty dancing in detail,none
what films has robert redford directed,movie.directed_by
i want to see a robert redford produced movie,movie.produced_by
i would like to see something produced by robert redford,movie.produced_by
bette midler movies,movie.starring.actor
bette midler movies please,movie.starring.actor
show bette midler movies,movie.starring.actor
show me cameron diaz movies,movie.starring.actor
show me movies with jennifer aniston,movie.starring.actor
russell crowe movies,movie.starring.actor
about life is beautiful,none
details about life is beautiful please,none
find synopsis for life is beautiful,none
i need page on life is beautiful,none
i want information about life is beautiful,none
i want to know about life is beautiful,none
i would like to view info on life is beautiful,none
life is beautiful,none
run a search for life is beautiful,none
show me life is beautiful information,none
what's the synopsis of life is beatiful,none
footloose,none
show jason statham movies,movie.starring.actor
find movies from new zealand,movie.country
show me the movies acted by bala krishna,movie.starring.actor
korean language movie,movie.language
show me korean language movie,movie.language
can you find the movies with korean language,movie.language
show me movies that are in korean,movie.language
portugese movies,movie.country_movie.language
current movie options for today with patrick swayze,movie.initial_release_date_movie.starring.actor
display all results for dirty dancing,none
find information on dirty dancing,none
search for dirty dancing,none
search for dirty dancing,none
how can i view dirty dancing,none
dirty dancing facts,none
did alfred hitchcock direct a comedy,movie.directed_by_movie.genre
martin lawrence directed what movie,movie.directed_by
find movies from japan,movie.country
show me movies from japan,movie.country
show me movies from japan,movie.country
what are some movies made in japan,movie.country
what movies came from japan,movie.country
which movies were made in japan,movie.country
i want to find a list of movies made in japan,movie.country
do you have any movies made in japan,movie.country
find japanese movies,movie.country_movie.language
find japanese movies,movie.country_movie.language
give me some names of japanese movies,movie.country_movie.language
i want japanese movies,movie.country_movie.language
i want to see japanese movies,movie.country_movie.language
i would like to know names of some of the japanese movies,movie.country_movie.language
japanese movies,movie.country_movie.language
show me a list of some japanese movies,movie.country_movie.language
show me japanese movies,movie.country_movie.language
sort in all japanese movies,movie.country_movie.language
do you have a list of japanese movies,movie.country_movie.language
i want to see a film in japanese,movie.language
show me movies in japanese,movie.language
films with japaneese,movie.language
what movies have people speaking japanese in them,movie.language
what are some japanese movies,movie.country_movie.language
find movies in british english,movie.language
find movies from miramax,movie.production_companies
see miramax movies,movie.production_companies
watch miramax,movie.production_companies
find movies with sandra bullock,movie.starring.actor
find sandra bullock movies,movie.starring.actor
movies with sandra bullock,movie.starring.actor
movies with vampires,movie.subjects
what movies about vampires are there,movie.subjects
movies will smith stars in,movie.starring.actor
show me will smith movies,movie.starring.actor
what experience does darla anderson have as a producer,movie.produced_by
look for movies directed by tyler perry,movie.directed_by
which movies are directed by tyler perry,movie.directed_by
give me movies directed by tyler perry,movie.directed_by
search for movies directed by tyler perry,movie.directed_by
what films has selena gomez been in,movie.starring.actor
find a movie with mel gibson,movie.starring.actor
only mel gibson movies,movie.starring.actor
find movies produced by paramount pictures,movie.production_companies
i want to see paramount movies,movie.production_companies
i would like a list of paramount movies,movie.production_companies
list some paramount produced films,movie.production_companies
show all movies by paramount,movie.production_companies
show me all the movies made by paramount,movie.production_companies
show only paramount movies,movie.production_companies
is there a list of movies about chess,movie.subjects
movies about chess,movie.subjects
movies regarding the hobby of chess,movie.subjects
list some of the best world war 2 films,movie.subjects
find movies about dogs,movie.subjects
find movies with a nc 17 only,movie.rating
find me nc-17 movies,movie.rating
show me nc seventeen movies,movie.rating
play movies from turkey,movie.country
what movies have come out of turkey,movie.country
can i have a list of bruce lee produced movies,movie.produced_by
can you give me a list of movies produced by bruce lee,movie.produced_by
show me movies produced by bruce lee,movie.produced_by
i want to see movies directed by michael bay,movie.directed_by
what movies did michael bay direct,movie.directed_by
ed harris films,movie.starring.actor
show me all movies that star ed harris,movie.starring.actor
more stuff about the movie go,none
is parenthood a comedy,movie.genre
find movies produced by mel gibson,movie.produced_by
what movies has jerry bruckheimer produced,movie.produced_by
i want to see chinese movies,movie.country_movie.language
show me chinese movies,movie.country_movie.language
show me dramas from china,movie.country_movie.genre
i want to watch a drama made in china,movie.country_movie.genre
give me the best baseball movies,movie.subjects
list movies filmed in ireland,movie.country_movie.locations
list all the movies john travolta has done,movie.starring.actor
columbia production company movies,movie.production_companies
find me 20 th century fox films,movie.production_companies
list of 20 th century fox films,movie.production_companies
watch century fox movies,movie.production_companies
films produced by twentieth century fox,movie.production_companies
find movies by twentieth century fox,movie.production_companies
find twentieth century fox movies,movie.production_companies
search twentieth century fox,movie.production_companies
show me movies by twentieth century fox,movie.production_companies
show me elvis movies,movie.starring.actor
do you have any pg thirteen rated movies,movie.rating
show me pg thirteen movies,movie.rating
what movies are rated pg thirteen,movie.rating
find pg thirteen movies,movie.rating
show me movies that are rated pg thirteen,movie.rating
list all movies rated pg-13,movie.rating
find movies with pg-13 only,movie.rating
i need to know names of some movies which have a rating of pg-13,movie.rating
i want to find pg-13 rated movies,movie.rating
pg-13 movies,movie.rating
which movies are rated pg-13,movie.rating
find a pg-13 movie,movie.rating
find me pg-13 movies,movie.rating
find movies that are rated pg-13,movie.rating
give me a list of some movies that have pg-13 rating,movie.rating
i want to see a list of g rated movies,movie.rating
list g,movie.rating
what is a list of g movies,movie.rating
are there any g movies out there right now,movie.rating
find me movies rated g,movie.rating
find movies only g,movie.rating
get me only g-rated movies,movie.rating
i want a list of movies rated g,movie.rating
i want to see g -rated films now,movie.rating
i want to take my kids to a g movie,movie.rating
list of g movies,movie.rating
list rating g,movie.rating
listing of g movies,movie.rating
look for movies rated g,movie.rating
look up movies with a g rating,movie.rating
play list g,movie.rating
please select the option to search for g rated movies,movie.rating
rating g,movie.rating
search for movies rated g,movie.rating
show me g rated movies,movie.rating
show only g rated movies,movie.rating
what available movies are rated g,movie.rating
what movies are currently playing that are rated g,movie.rating
find me movies rated g,movie.rating
find movies that are rated g,movie.rating
find movies with g rating,movie.rating
g movies,movie.rating
it is hard to find a movie that is rated g anymore,movie.rating
list movies rated g,movie.rating
only movies rated g,movie.rating
rating g list,movie.rating
show me g movies,movie.rating
there are several g movies,movie.rating
appropriate for kids,movie.rating
what movies can young children watch,movie.rating
watch pg and g movies,movie.rating
did robert wise direct any other musical films,movie.directed_by_movie.genre
find love stories,movie.subjects
find love stories,movie.subjects
show me a list of movies produced by mgm,movie.production_companies
movies from the uk,movie.country
show me british films,movie.country
list uk movies,movie.country
get films from the united kingdom,movie.country
i want to watch a comedy made in norway,movie.country_movie.genre
get me a list of movies that ron howard produce,movie.produced_by
ron howard movies produce list,movie.produced_by
list movies directed by clint eastwood,movie.directed_by
show director clint eastwood movies,movie.directed_by
what movies did clint eastwood direct,movie.directed_by
movies directed by clint eastwood,movie.directed_by
list movies produced by sean penn,movie.produced_by
find movies about vietnam,movie.subjects
what movies has spielberg been a producer on,movie.produced_by
i would like to select the option to search for movies produced by stephen spielberg,movie.produced_by
please list all movies that stephen spielberg produced,movie.produced_by
select the option to search for movies produced by stephen spielberg,movie.produced_by
which productions are from stephen spilberg,movie.produced_by
find movies produced by steven spielberg,movie.produced_by
list steven spielberg produced movies,movie.produced_by
show me movies produced by stephen spielberg,movie.produced_by
was kevin james in hitch,movie.starring.actor
was will smith in hitch,movie.starring.actor
show me a list of disney movies,movie.production_companies
give me a list of some movies by producer walt disney,movie.production_companies
list all movies that walt disney produced,movie.production_companies
show all movies directed by ron howard,movie.directed_by
what movies has ron howard directed,movie.directed_by
find movies by ron howard,movie.directed_by
show movies directed by ron howard,movie.directed_by
find movies produced by brian glazer,movie.produced_by
list spielberg movies,movie.directed_by
show spielberg movies,movie.directed_by
what did spielberg direct,movie.directed_by
stephen spielberg movies,movie.directed_by
filmography for steven spielberg,movie.directed_by
find movies directed by steven spielberg,movie.directed_by
find steven spielberg movies,movie.directed_by
i want to find movies directed by stephen speilberg,movie.directed_by
list all steven spielberg movies,movie.directed_by
please find the movies by steven spielberg,movie.directed_by
show films by steven spielberg,movie.directed_by
show steven spielberg movies,movie.directed_by
show steven spielberg movies,movie.directed_by
steven spielberg movies,movie.directed_by
steven spielberg pictures,movie.directed_by
what movies has steven spielberg done,movie.directed_by
find movies directed by steven spielberg,movie.directed_by
movie by steven spielberg,movie.directed_by
movie stuff for steven spielberg,movie.directed_by
movies by steven spielberg,movie.directed_by
movies directed by steven spielberg,movie.directed_by
can i see what movies steven spielberg has done,movie.directed_by
can you find movies with steven spielberg,movie.directed_by
spielberg movies,movie.directed_by
videos of steven spielberg,movie.directed_by
find a list of movies directed by spielberg,movie.directed_by
show me the movies that spielberg made,movie.directed_by
can you please search for movies by steven spielberg,movie.directed_by
find movies directed by stephen spielberg,movie.directed_by
find movies directed by stephen spielberg,movie.directed_by
i would like to search for movies directed by stephen spielberg,movie.directed_by
list some movies directed by steven spielberg,movie.directed_by
please find movies directed by stephen spielberg,movie.directed_by
show me movies directed by steven spielberg,movie.directed_by
show me the movies directed by steven spielberg,movie.directed_by
which movies are from stephen spielberg,movie.directed_by
gilda charles vidor,movie.directed_by
show me movie gilda by charles vidor,movie.directed_by
find some musical movies,movie.genre
looking for a musical movie,movie.genre
show me a list of musicals,movie.genre
find the movie hum tum,none
find movies directed by eddie murphy,movie.directed_by
search movies by noah baumbach,movie.directed_by
search chick flicks,movie.genre
can you show me movies about war,movie.subjects
show me some war themed movies,movie.subjects
show movies concerning war,movie.subjects
please list movies about war,movie.subjects
list movies about war,movie.subjects
what movies are made by twentieth century fox television,movie.production_companies
find movies directed by todd solondz,movie.directed_by
find me movies with hugh jackman,movie.starring.actor
what ron howard movies are rated pg-13,movie.directed_by_movie.rating
look for dramas made or shot in france,movie.country_movie.genre
find movies from france,movie.country
i want to see movies from france,movie.country
movies from france,movie.country
what are all the movies to come out of france,movie.country
give me a list of movies made in france,movie.country
i am looking for movies made in france,movie.country
i want to see a list of movies that were made in france,movie.country
i would like to view any movies made in france,movie.country
please show me movies made in france,movie.country
find movies from france,movie.country
find movies from france,movie.country
what movies were filmed in france,movie.country
find french films,movie.country_movie.language
find french movies,movie.country_movie.language
find french movies,movie.country_movie.language
french movies,movie.country_movie.language
i would like to see french movies,movie.country_movie.language
list french movies,movie.country_movie.language
look for french movies,movie.country_movie.language
look up french movies,movie.country_movie.language
show me french movies,movie.country_movie.language
show me only french foreign films,movie.country_movie.language
are there any french films showing,movie.country_movie.language
show me mystery movies,movie.genre
find movies produced by disney pixar,movie.production_companies
show me pixar films,movie.production_companies
find movies produced by lucas films,movie.production_companies
i would like to find movies starring the singer mario,movie.starring.actor
look for movies starring the singer mario,movie.starring.actor
search for movies starring the singer mario,movie.starring.actor
bring up all diving movies,movie.subjects
bring up all diving related movies,movie.subjects
show me all movies about diving,movie.subjects
show me diving movies,movie.subjects
sort in all diving movies,movie.subjects
what is the plot of vulgaria,none
find movies by mosfilm,movie.production_companies
search for movies that were produced by mosfilm,movie.production_companies
what films deal with immigrants in america,movie.subjects
look for cher movies,movie.starring.actor
show me cher movies,movie.starring.actor
eva mendes films,movie.starring.actor
the god father,none
i need a list of tom hanks movies,movie.starring.actor
i want to view only movies with tom hanks,movie.starring.actor
i want to watch movies with tom hanks,movie.starring.actor
list tom hanks movies for me,movie.starring.actor
movies with tom hanks,movie.starring.actor
show me tom hanks movies,movie.starring.actor
show tom hanks movies,movie.starring.actor
tom hanks movies,movie.starring.actor
watch tom hanks,movie.starring.actor
what other movies did tom hanks star in,movie.starring.actor
find movies produced by morgan freeman,movie.produced_by
producer tom hanks movies,movie.produced_by
what did tom hanks produces,movie.produced_by
find movies directed by oliver stone,movie.directed_by
find oliver stone directed movies,movie.directed_by
i need movies directed by oliver stone,movie.directed_by
please provide movies directed by oliver stone,movie.directed_by
show movies directed by oliver stone,movie.directed_by
name all of the movies john singleton has directed,movie.directed_by
what are all of the movies that john singleton has directed,movie.directed_by
show me movies in greek,movie.language
are there any movies in greek,movie.language
can i see all movies starring alan rickman,movie.starring.actor
show me movies with alan rickman,movie.starring.actor
show movies charlie sheen,movie.starring.actor
funny pg thirteen movies,movie.genre_movie.rating
find movies produced by albert ruddy,movie.produced_by
please look up movies produced by albert ruddy,movie.produced_by
list all movies produced by alfred ruddy,movie.produced_by
search for movies produced by albert ruddy,movie.produced_by
what movies has albert ruddy produced,movie.produced_by
what movies have albert ruddy produced,movie.produced_by
which movie was produced by albert rudy,movie.produced_by
which all movies are produced by yash chopra,movie.produced_by
the camp out,none
get all brad pitt produced movies,movie.produced_by
what movies have brad pitt produced,movie.produced_by
what movies were produced by brad pitt,movie.produced_by
find movies starring halle berry,movie.starring.actor
look for films with halle berry,movie.starring.actor
search movies in which halle berry acted,movie.starring.actor
films by mel gibson,movie.directed_by
search movies made by mel gibson,movie.directed_by
movies by mel gibson,movie.directed_by
show me a list of movies directed by mel gibson,movie.directed_by
is this movie a romance,movie.genre
home this movie is in english,movie.language
hope this movie is in english,movie.language
i hope this movie would be in english,movie.language
need to provide more info about the movie content,movie.subjects
is the other guys a comedy,movie.genre
what movies have robert deniro produced,movie.produced_by
find me a list of movies directed by james cameron,movie.directed_by
find movies directed by james cameron,movie.directed_by
i want to find movies by director james cameron,movie.directed_by
list all of the movies directed by james cameron,movie.directed_by
list movies directed by james cameron,movie.directed_by
watch james cameron movies,movie.directed_by
can you show me a list of all the movies directed by james cameron,movie.directed_by
show me a list of all the movies directed by james cameron,movie.directed_by
show me other movies produced by james cameron,movie.produced_by
show me the movies that james cameron has produced,movie.produced_by
find me some warner bros. movies,movie.production_companies
i want to see movies produced by warner bros,movie.production_companies
show me a list of all warner bros. films,movie.production_companies
show me all films produced by warner bros.,movie.production_companies
show me the movies produced by warner bros,movie.production_companies
what are the films that warner bros. produced,movie.production_companies
i need to see some movies from warner brothers,movie.production_companies
search for warner brothers movies,movie.production_companies
i would love to see some movies produced by the wb,movie.production_companies
what movies has jj abrams procuced,movie.produced_by
show recent films starring bruce willis,movie.initial_release_date_movie.starring.actor
list recent films with actor bruce willis,movie.initial_release_date_movie.starring.actor
find john cusack movies,movie.starring.actor
get john cusack movies for me,movie.starring.actor
look for john cusack movies,movie.starring.actor
look for wes anderson films,movie.directed_by
i would like to know the names of all the movies which have george clooney in them,movie.starring.actor
which are some of the movies that have george clooney in them,movie.starring.actor
show me some films produced by jon landau,movie.produced_by
about finding nemo,none
about finding nemo,none
about finding nemo,none
all about finding nemo,none
detail finding nemo,none
find me more about finding nemo,none
finding nemo,none
finding nemo,none
finding nemo details please,none
finding nemo info,none
how can i get more information on finding nemo,none
i need general information on finding nemo,none
information on finding nemo,none
information on finding nemo,none
look up finding nemo,none
open page for finding nemo,none
please find me some info on finding nemo,none
run a search for finding nemo for me please,none
show details of the original finding nemo,none
show finding nemo,none
show me finding nemo,none
show me the official site for finding nemo,none
synopsis for finding nemo,none
synopsis for finding nemo,none
where can i find information on finding nemo,none
about the campaign,none
i would like to get all the information about the the campaign,none
run a search for the campaign,none
the campaign,none
what is the campaign about,none
show me apollo thirteen,none
frank capra movies,movie.directed_by
find movies produced by castle rock entertainment,movie.production_companies
what movies does jake gyllenhaal star in,movie.starring.actor
get a list of movies with kristen stewart,movie.starring.actor
kristen stewart top movies,movie.starring.actor
show me all movies kristen stewart has been in,movie.starring.actor
what movies have kristen stewart done,movie.starring.actor
which movies has kristen stewart been in,movie.starring.actor
list movie info kristen stewart,movie.starring.actor
find movie info kristenn stewart,movie.starring.actor
movie info kristen stewart,movie.starring.actor
show lionsgate director movies,movie.production_companies
display movies made by production lionsgate,movie.production_companies
i want to see a list of lionsgate movies,movie.production_companies
lionsgate films,movie.production_companies
lionsgate list,movie.production_companies
lionsgate movies,movie.production_companies
list lionsgate movies,movie.production_companies
search for lionsgate movies,movie.production_companies
what movies has lionsgate done,movie.production_companies
michelle phifer movie list,movie.starring.actor
find danish movies,movie.country_movie.language
show me the movies acted by chiranjeevi,movie.starring.actor
what movies has charles vidor directed,movie.directed_by
