utterances,Core Relations
what is the calendar date release for looper,movie.initial_release_date
i would like to know the release date of the movie barfi,movie.initial_release_date
i need to know the release date of the movie barfi,movie.initial_release_date
what is the release date of the movie barfi,movie.initial_release_date
show me the release date of the movie barfi,movie.initial_release_date
find the release date for heroine,movie.initial_release_date
please find the release date of heroine,movie.initial_release_date
what is the release date of heroine,movie.initial_release_date
when was herione released,movie.initial_release_date
when was the movie heroine released,movie.initial_release_date
when was house at the end of the street released,movie.initial_release_date
when house at the end of the street showing,movie.initial_release_date
what is the release date for house at the end of the street,movie.initial_release_date
is iron man 3 in theatres yet,movie.initial_release_date
when is iron man 3 coming out,movie.initial_release_date
when will iron man 3 be out in movie theatres,movie.initial_release_date
show me movies listed by directors,movie.directed_by
director for gone with the wind,movie.directed_by
show me the directors of gone with the wind,movie.directed_by
who are the directors of gone with the wind,movie.directed_by
who directed gone with the wind,movie.directed_by
who directed gone with the wind,movie.directed_by
who directed gone with the wind,movie.directed_by
who directed the movie,movie.directed_by
show me details about the directors of gone with the wind,movie.directed_by
who directed black swan,movie.directed_by
who made batman the dark knight,movie.directed_by
show me the director of the film the dark knight,movie.directed_by
tell me the director of the film the dark knight,movie.directed_by
who directed the movie the dark knight,movie.directed_by
who filmed the dark knight,movie.directed_by
who is the person that directed the film the dark knight,movie.directed_by
who directed hard days night,movie.directed_by
who directed cast away,movie.directed_by
show me the director of forest gump,movie.directed_by
who was the director of forest gump,movie.directed_by
who is director of sleepless in seattle,movie.directed_by
who directed the movie opening night,movie.directed_by
who directed the movie men in black 3,movie.directed_by
who was the director in men in black 3,movie.directed_by
can you tell me the director of the titanic,movie.directed_by
director for titanic,movie.directed_by
who was the director of the movie titanic,movie.directed_by
display director of the movie avengers,movie.directed_by
director of the avengers,movie.directed_by
search director of the exorcist,movie.directed_by
find the director for the social network,movie.directed_by
find the director of big,movie.directed_by
who is the director of ghost busters,movie.directed_by
find the director for pretty woman,movie.directed_by
who made godzilla,movie.directed_by_movie.produced_by
rocky director,movie.directed_by
who directed hope floats,movie.directed_by
avatar was directed by whom,movie.directed_by
director of avatar,movie.directed_by
which director directed avatar,movie.directed_by
who did avatar,movie.directed_by
who directed avatar,movie.directed_by
who directed avatar,movie.directed_by
who directed avatar,movie.directed_by
who directed the film avatar,movie.directed_by
who directed the movie called avatar,movie.directed_by
who made the movie avatar,movie.directed_by
who was the director of the movie avatar,movie.directed_by
who directed star wars four,movie.directed_by
who directed the movie in july,movie.directed_by
who made steel magnolias,movie.directed_by
the silence of the lambs director,movie.directed_by
director of the incredibles,movie.directed_by
gilda director,movie.directed_by
list gilda director,movie.directed_by
search director for gilda,movie.directed_by
search gilda director,movie.directed_by
the movie gilda director,movie.directed_by
who directed gilda,movie.directed_by
who directed gilda,movie.directed_by
who directed gilda,movie.directed_by
who directed the movie gilda,movie.directed_by
goodfellas director,movie.directed_by
who made field of dreams,movie.directed_by
who made the movie field of dreams,movie.directed_by
who made the movie field of dreams possible,movie.directed_by
can i please see more details for the director of finding nemo,movie.directed_by
find the director for finding nemo,movie.directed_by
i want to know the director of finding nemo,movie.directed_by
i want to know who directed finding nemo,movie.directed_by
show me finding nemo director,movie.directed_by
who directed finding nemo,movie.directed_by
who directed finding nemo,movie.directed_by
who directed finding nemo,movie.directed_by
who directed finding nemo,movie.directed_by
who directed finding nemo,movie.directed_by
who directed finding nemo,movie.directed_by
who was the director of the film finding nemo,movie.directed_by
who directed hitch,movie.directed_by
who made hitch,movie.directed_by
director for anne of green gables,movie.directed_by
search director of the movie platoon,movie.directed_by
who was the director of movie varsham,movie.directed_by
who directed grizzly man,movie.directed_by
who directed to kill a mockingbird,movie.directed_by
who was the director of the movie e t,movie.directed_by
find the director for et,movie.directed_by
who made et,movie.directed_by
who was the director of the movie jaws,movie.directed_by
who directed jurassic park,movie.directed_by
who directed jurassic park,movie.directed_by
who directed jurassic park,movie.directed_by
old man director,movie.directed_by
can you find out who directed the movie batman,movie.directed_by
can you tell me who is the director of batman,movie.directed_by
who directed batman,movie.directed_by
who is the director of batman,movie.directed_by
looper directors,movie.directed_by
who directed the perfect storm,movie.directed_by
who directed dirty dancing,movie.directed_by
director for pride and prejudice,movie.directed_by
who directed the movie the thing called love,movie.directed_by
director of twilight,movie.directed_by
twilight was directed by whom,movie.directed_by
who else directs zombie movies,movie.directed_by_movie.subjects
director of hum tum,movie.directed_by
director of the movie hum tum,movie.directed_by
find the director of hum tum,movie.directed_by
look for the director of hum tum,movie.directed_by
director of the cabin in the woods,movie.directed_by
i am interested in who directed cabin in the woods,movie.directed_by
show me who directed cabin in the woods,movie.directed_by
who directed the movie cabin in the woods,movie.directed_by
who directed soul surfer,movie.directed_by
who directed the sandlot,movie.directed_by
which director made a comedy,movie.directed_by_movie.genre
director of halloween,movie.directed_by
find the director of step up,movie.directed_by
search for the director of step up,movie.directed_by
search for the director of step up,movie.directed_by
i need to know who directed black swan,movie.directed_by
i want to look for the director of freedom writers,movie.directed_by
i would like to look for the director of freedom writers,movie.directed_by
who directed the movie titanic,movie.directed_by
who was the director of the movie the mechanic,movie.directed_by
find the director of mask,movie.directed_by
director of the hulk,movie.directed_by
did robert wise direct the sound of music,movie.directed_by
was robert wise the only director of the sound of music,movie.directed_by
who directed the sound of music,movie.directed_by
who directed the sound of music,movie.directed_by
who directed the sound of music,movie.directed_by
what director shot the 1st lord of the rings film,movie.directed_by
who directed return,movie.directed_by
who is the director of return,movie.directed_by
search for the name of the director of return,movie.directed_by
what was the name of the director in men in black 3,movie.directed_by
what is the name of the director of the movie avengers,movie.directed_by
find the name of the director of chips,movie.directed_by
name of director for house at the end of the street,movie.directed_by
name the director of sleepless in seattle,movie.directed_by
find name of director of the movie platoon,movie.directed_by
get me the name of who directed the master,movie.directed_by
what is the director's name of lord of the rings,movie.directed_by
what is the name of the person who made et,movie.directed_by
rocky director's name,movie.directed_by
what type of movie is gilda,movie.genre
what types of movies does lionsgate produce,movie.genre_movie.production_companies
what kind of movie is black swan,movie.genre
what genre is the hunger games,movie.genre
genre for transformers,movie.genre
what genre is looper,movie.genre
what genre is the movie looper,movie.genre
what genre is rambo,movie.genre
what genre is the jaws movies,movie.genre
can you tell me the genre for 1000 words,movie.genre
i am interested in the genre for 1000 words,movie.genre
what type of movie is parenthood,movie.genre
give me the genre of the movie lawless,movie.genre
what genre is the movie lawless,movie.genre
what is the genre of the movie lawless,movie.genre
what genre is the movie in july,movie.genre
genre for gone with the wind,movie.genre
how is the movie classified,movie.genre
what genre is the movie,movie.genre
what is the movie category,movie.genre
how would you describe the movie,movie.genre
type of movie,movie.genre
what is the classification of movie,movie.genre
what is the genre for movie,movie.genre
what is the movie genre,movie.genre
what kind of movie,movie.genre
what type of movie is this,movie.genre
i would like look up the genre step up is in,movie.genre
search for the genre step up in,movie.genre
what genre is step up in,movie.genre
what genre is calendar girls in,movie.genre
what is the genre for the patriot,movie.genre
what genre is network in,movie.genre
find out the genre for the movie rebel,movie.genre
genre for the avengers,movie.genre
can you tell me what genre the movie avatar falls in,movie.genre
i need to know the genre of the movie avatar,movie.genre
show me the genre of the movie avatar,movie.genre
what genre is superman,movie.genre
pretty girl movie genre,movie.genre
what genre is pretty girl,movie.genre
what genre is the movie pretty girl,movie.genre
find out what kind of movie grease is,movie.genre
i d like to know the genre of the film grease,movie.genre
i would like to know the genre of grease,movie.genre
what kind of movie is grease,movie.genre
find out the genre for the movie annamayya,movie.genre
what movie category is friday the 13th,movie.genre
tell me what genre the tommyknockers is,movie.genre
what genre is the hangover,movie.genre
what catergory is ted in,movie.genre
what genre is ted considered,movie.genre
what type of movie is ted considered to be,movie.genre
genre for while you were sleeping,movie.genre
what genre is finding nemo,movie.genre
which language is used in the movie,movie.language
language of sound of music,movie.language
what language is this film,movie.language
what are the different languages this movie come in,movie.language
what foreign language is spoken in movie,movie.language
what language is movie in,movie.language
what language is the movie in,movie.language
what language is the movie in,movie.language
language of anna karinia,movie.language
language of godzilla movie,movie.language
language of hamlet,movie.language
can you tell me the language of the movie hero,movie.language
i need to know what is the language of the movie hero,movie.language
tell me what is the language of the movie hero,movie.language
language of bullhead,movie.language
what language did the characters speak in black swan,movie.language
what language is black swan,movie.language
please find what language the chaser is in,movie.language
what language is the chaser in,movie.language
look up what language the chaser is in,movie.language
what language is la havre in,movie.language
what foreign language is the movie belle available to view in,movie.language
what language can i watch the movie the professional,movie.language
what language is the professional in,movie.language
how do they speak in the movie the professional,movie.language
what language is spoken in indochine,movie.language
language of the film revanche,movie.language
what language was aguirre wrath of god in,movie.language
what language is passion of the christ in,movie.language
i want to know in what language was ju on filmed,movie.language
i want to know the original language of ju on,movie.language
tell me the language of ju on,movie.language
what language is ju on on,movie.language
what language is the movie elling in,movie.language
language of a separation,movie.language
what s the language of moscow does not believe in tears,movie.language
what is the language of the movie aankhen,movie.language
can you tell me the language of the movie aankhen,movie.language
what are the names of films produced by steven spielberg,movie.produced_by
can you tell me names of some movies by director martin scorsese,movie.directed_by
find movie titles,none
what are the names of movies made in the united states,movie.country
i would like to know the names of all the movies which have been directed by james cameron,movie.directed_by
what are the titles of all the movies that george lucas produced,movie.produced_by
names of romantic indian films,movie.country_movie.genre_movie.language
can you show me names of some indian romantic movies,movie.country_movie.genre_movie.language
i would like to know names of some indian movies,movie.country_movie.language
japanese movie titles,movie.country_movie.language
can you give me names of some movies having pg thirteen rating,movie.rating
i would like to get names of some movies with pg thirteen rating,movie.rating
show me names of some romantic movies having a pg thirteen rating,movie.genre_movie.rating
what are the names of movies with zombies in them,movie.subjects
i need to know the names of all the movies produced by william packer,movie.produced_by
stephen king directed what movie,movie.directed_by
what movies did stephen king direct,movie.directed_by
watch the last james cameron movie,movie.directed_by_movie.initial_release_date
find movies by release date,movie.initial_release_date
show movie ratings,movie.rating
movie ratings,movie.rating
richard lester produced what other movies,movie.produced_by
show me westerns,movie.genre
was kevin bacon in apollo thirteen,movie.starring.actor
i need movie information for life is beautiful,none
life is beautiful movie page,none
i want to know more about the movie life is beautiful,none
i would like info on the movie life is beautiful,none
please show me info on the movie life is beautiful,none
search for the movie life is beautiful,none
what are the particulars for the movie life is beautiful,none
can i see more info the movie life is beautiful,none
can you show me info on the movie life is beautiful please,none
display information for the movie life is beautiful,none
find movies about dancing,movie.subjects
i want to look up movies about dancing,movie.subjects
look up movies about dancing,movie.subjects
search for movies about dancing,movie.subjects
give me a list of will ferrell films,movie.starring.actor
i want to see any movies will ferrell has been in,movie.starring.actor
i would like to see will ferrell movies,movie.starring.actor
list will ferrell films,movie.starring.actor
movies will ferrell played in,movie.starring.actor
what are some films will ferrell starred in,movie.starring.actor
what movies has will ferrell been in,movie.starring.actor
what movies is will ferrell in,movie.starring.actor
will ferrell films,movie.starring.actor
will ferrell movies,movie.starring.actor
will ferrell movies,movie.starring.actor
will ferell videos,movie.starring.actor
i want to see videos of will ferrell,movie.starring.actor
all videos of will ferrell,movie.starring.actor
can you find me movies in russian,movie.language
where can i find movies in russian,movie.language
find russian movies,movie.country_movie.language
find russian movies,movie.country_movie.language
search for russian movies,movie.country_movie.language
show me movies from poland,movie.country
i would like to see a polish language film,movie.language
i am interested in watching a movie in polish,movie.language
i want to see a polish movie,movie.country_movie.language
list some funny russian movies,movie.country_movie.genre_movie.language
i am looking for the information on the movie pretty women,none
list of barry sonnenfeld films,movie.directed_by
find martin scorsese films,movie.directed_by
i want to see a movie which was directed by scorsese,movie.directed_by
show all movies directed by martin scorcese,movie.directed_by
movies with meg ryan,movie.starring.actor
gross earnings for movies,movie.gross_revenue
i want to watch movies directed by jackie chan,movie.directed_by
star wars,none
what are the plots of hotel rwanda,none
tim burton movies,movie.directed_by
bings movie page finding nemo,none
display information for film finding nemo,none
finding nemo movie shortcut,none
whats some details for the movie finding nemo,none
show all details of original finding nemo movie,movie.initial_release_date
get details of original finding nemo movie,movie.initial_release_date
finding nemo movie page,none
find movie finding nemo,none
display all details of original finding nemo movie,none
find all details of original finding nemo movie,none
what has andrew stanton directed,movie.directed_by
what movies has andrew stanton directed,movie.directed_by
what did lee unkrich direct,movie.directed_by
i would like to see a movie with albert brooks in it,movie.starring.actor
find me films produced by drew barrymore,movie.produced_by
what movies that clint eastwood starred in did he also direct,movie.directed_by_movie.starring.actor
what movies did clint eastwood direct and star in,movie.directed_by_movie.starring.actor
i want to watch a movie by sergio leone,movie.directed_by
show me movies directed by sergio leone,movie.directed_by
movies that have been directed by tony scott,movie.directed_by
show me movies from brazil,movie.country
show me horror movie earnings,movie.genre_movie.gross_revenue
movies with harrison ford,movie.starring.actor
show me only movies with harrison ford,movie.starring.actor
name the movies clive owen has been in,movie.starring.actor
what movies has clive owen been in,movie.starring.actor
what movies has clive owen starred in,movie.starring.actor
find ms. congeniality,none
find spike lee directed movies,movie.directed_by
what movies did spike lee direct,movie.directed_by
movies cecil b demille,movie.directed_by
i want to see a comedy in spanish,movie.genre_movie.language
find films,none
find films,none
find movies,none
in search for movies,none
looking for movies,none
find a movie,none
are there movies not rated g,movie.rating
can you find some drama movies,movie.genre
i'd like to watch something with drama,movie.genre
looking for a drama movie,movie.genre
show me a list of movies in english,movie.language
show me english movies,movie.language
find english movies,movie.language
can i get a list of movies available in english,movie.language
show me movies in english,movie.language
i would like to see movies in english,movie.language
movies in english,movie.language
show me a list of all movies made in the united states,movie.country
what are all movies made by united states,movie.country
what movies have been made in the united states,movie.country
movies from the us,movie.country
what are all of the movies made in usa,movie.country
i want to see movies made in america,movie.country
show me a list of movies made in america,movie.country
show me movies made in america,movie.country
please tell me if you have any movies from the united states,movie.country
movies from the us,movie.country
please tell me about movies from the usa,movie.country
english movie list,movie.country_movie.language
show me thrillers,movie.genre
show me thrillers,movie.genre
show me comedies,movie.genre
looking for a comedy movie,movie.genre
see comedy,movie.genre
show me comedy movies,movie.genre
show me funny movies,movie.genre
movies that have comedy,movie.genre
can you show me a list of scary movies,movie.genre
i am in the mood for a horror film,movie.genre
looking for a horror movie,movie.genre
search for horror movies,movie.genre
show me horror movies,movie.genre
show only horror movies,movie.genre
show me a list of scary movies,movie.genre
i want to see a list of scary movies,movie.genre
funny scary movies,movie.genre
movies by producer,movie.produced_by
find movies by producer,movie.produced_by
movies with bruce willis,movie.starring.actor
clint eastwood movies,movie.starring.actor
find movies from canada,movie.country
get me canadian movies,movie.country
show me movies from canada,movie.country
look up information about canadian movies,movie.country
get movies from canada,movie.country
show me a list of any movies made in canada,movie.country
find movies filmed in canada,movie.country
get films made in canada,movie.country
show me canadian films,movie.country
show me canadian movies,movie.country
are there any canadian movies,movie.country
are there any canadian movies,movie.country
find canadian films,movie.country
what are some movies made outside the us,movie.country
movies from germany,movie.country
i want to watch movies from germany,movie.country
display movies made in germany,movie.country
find movies done in germany,movie.country
what movies do you have that were made in italy,movie.country
movies from italy,movie.country
does italy make any movies,movie.country
find italian movies,movie.country_movie.language
italian films,movie.country_movie.language
italian movies,movie.country_movie.language
show me italian movies,movie.country_movie.language
get all italian language movies,movie.language
send me movies that are in italian,movie.language
movies with italian language,movie.language
show me movies in italian,movie.language
what movies are in italian,movie.language
search for movies in italian,movie.language
find movies in italian,movie.language
a list of all italian speaking movies,movie.language
give me a list of movies from spain,movie.country
see movies from spain,movie.country
movies from spain,movie.country
movies from spain,movie.country
i want to see movies from spain,movie.country
movies made in spain,movie.country
are there any movies made in spain,movie.country
bring up spanish movies,movie.country_movie.language
can you show me movies spanish,movie.country_movie.language
can you show me spanish movies,movie.country_movie.language
find spanish movies,movie.country_movie.language
find spanish movies,movie.country_movie.language
get me spanish movies,movie.country_movie.language
I'd like a list of spanish movies,movie.country_movie.language
I'd like to know some spanish movies,movie.country_movie.language
i want only spanish movies,movie.country_movie.language
i want to look up spanish movies,movie.country_movie.language
list spanish movies,movie.country_movie.language
list spanish movies,movie.country_movie.language
look for spanish movies,movie.country_movie.language
search for spanish movies,movie.country_movie.language
search for spanish movies,movie.country_movie.language
show me spanish movies,movie.country_movie.language
spanish movie listing,movie.country_movie.language
spanish movies,movie.country_movie.language
find romance movies,movie.genre
give me a list of romance movies,movie.genre
find me romantic movies,movie.genre
i want to find romantic movies,movie.genre
locate romantic movies for me,movie.genre
list some movies that are in french,movie.language
find french language movies,movie.language
find movies in french,movie.language
find movies is french,movie.language
list movies in french,movie.language
look for movies in french,movie.language
search for movies in french,movie.language
search for movies in french,movie.language
show me movies produced in french,movie.language
show movies in french,movie.language
show only movies that are in french,movie.language
find french language movies,movie.language
list of all french speaking films,movie.language
list of french language movies,movie.language
show me movies in french,movie.language
can you list movies in french,movie.language
find all films showing in french,movie.language
show me a list of all the movies produced by william packer,movie.produced_by
information about movie,none
show me information about movie,none
show me information on movie,none
tell me about movie,none
please show me all of the films that involve kevin bacon,movie.starring.actor
i want movies about 9-11,movie.subjects
what other movies has bill paxton starred in,movie.starring.actor
find some suspenseful movies,movie.genre
a movie based on time travel,movie.subjects
find time travel movies,movie.subjects
give me a list of time travel movies,movie.subjects
movies about time travel,movie.subjects
show me movies about time travel,movie.subjects
show me movies with time travel themes,movie.subjects
show me time travel movies,movie.subjects
show videos about time travel,movie.subjects
time travel movies,movie.subjects
what are movies whose topic involves time travel,movie.subjects
movies about time travel,movie.subjects
movies about time travel,movie.subjects
show me movies about time travel,movie.subjects
show me movies about time travel,movie.subjects
show me some movies that are related to time travel,movie.subjects
what are some movies that involve time travel,movie.subjects
what movies discuss time travel,movie.subjects
quentin tarrantino movies,movie.directed_by
what movies did quentin terrantino direct,movie.directed_by
list the movies anna paquin has starred in,movie.starring.actor
